Subject,Topic,Direction,Question,Option 1,Option 2,Option 3,Option 4,Option 5,Answer,Explanation
G.K,Misslaneous, ,Who invented Internal Combustion Engine?,Roger Bacon,Karl Benz,Dr. Alan M. Turing,Otto, ,D," No answer description available for this question. <a href=""discussion-811"">Let us discuss</a>. "
G.K,Misslaneous, ,When was Monopoly created?,1940s,1930s,1920s,1950s, ,B," After the Stock Market crash, a buying and selling game created by Charles Darrow came to be. The first games were hand drawn on linoleum with streets from Atlantic City, N.J. as the property. He took the game to the Parker Brothers company, and Monopply was brought out for Christmas 1934. Everyone wanted to buy the games after Christmas, and Monopoly became a big success.  "
G.K,Misslaneous, ,What furniture item was invented by California furniture designer Charles Prior Hall in 1968?,Sofa bed,Captain's chair,Waterbed,Hammock, ,C," No answer description available for this question. <a href=""discussion-860"">Let us discuss</a>. "
G.K,Misslaneous, ,The Manhattan Project was started by President Roosevelt in 1942 to ensure that the U.S. beat the Germans in developing a nuclear bomb. Whom did Roosevelt appoint as scientific head the Manhattan Project?,Robert Oppenheimer,James B. Conant,Leslie R. Groves,Vannevar Bush, ,A," Leslie R. Groves, however, was the military head of the project and the overall supremo, while Robert Oppenheimer was the scientific director. The world's first atomic bomb was exploded in the New Mexico desert on July 16, 1945. "
G.K,Misslaneous, ,When was the first lawn mower invented?,1830,1854,1835,1849, ,A," The first lawn mowers were not engine powered. Invented in 1830 by Edwin Budding of England, the mowers were turning blades on wooden sticks used to cut grass. Engine powered mowers were not invented until 1919 by an American Army colonel, who used the motor from a washing machine. "
G.K,Misslaneous, ,In which decade were the first successful diode and triode vacuum tubes invented?,1800s,1880s,1890s,1900s, ,D," In 1904, John Ambrose Fleming invented the first practical electron tube called the 'Fleming Valve', which is a diode rectifier. In 1906, Lee de Forest invented the audion later called the triode, which provided signal amplification. "
G.K,Misslaneous, ,Who is the English physicist responsible for the 'Big Bang Theory'?,Albert Einstein,Michael Skube,George Gamow,Roger Penrose, ,C," George Gamow. Gamow, who died in 1968, was a physicist, who published ""Thirty Years that Shook Physics"". "
G.K,Misslaneous, ,"What 'game' was first produced by the Southern Novelty Company in Baltimore, Maryland in 1892?",Frisbee,Monopoly,Ouija board,Ping Pong, ,C," The board was invented by Isaac and William Fuld. The word 'Ouija' comes from the French and German words for 'yes', 'oui' and 'ja'. "
G.K,Misslaneous, ,Who had an explosive idea and first patented DYNAMITE?,J. R. Gluber,A. Nobel,G. Fawks,W. Bickford, ,B, Alfred Noble patented dynamite in 1876. Nobel left $9 million in his will to be used as awards for people whose work benefit humanity - The Nobel Peace Prize etc. 
G.K,Misslaneous, ,Who invented the Spinning Jenny?,Thornton Hargreaves,Peter Hargreaves,James Hargreaves,Simon Hargreaves, ,C, Awarded a Patent in 1770. It used 8 bobbins at once. 
G.K,Misslaneous, ,Which insurance salesman invented the fountain pen in 1884?,Lewis Edson Waterman,Sir William Grove,Charles Kettering,George Fountain, ,A, Lewis Edson Waterman patented the first practical fountain pen in 1884. 
G.K,Misslaneous, ,When was the first elevator built?,1743,1739,1760,1785, ,A," The first elevator was built in the palace of King Louis XV. It only traveled up one floor, and was hand powered by men inside the chimney. "
G.K,Misslaneous, ,"What charge card, developed in 1950, was the first to be accepted nationally in the US?",Visa,Discover,MasterCharge,Diner's Club, ,D, The card was invented by Frank McNamara and Ralph Schneider. 
G.K,Misslaneous, ,What Enrico Fermi invented?,X ray machine,Betatron,Cyclotron,Nuclear reactor, ,D, Invented in 1942. 
G.K,Misslaneous, ,Which of the following was first patented by an Australian in 1889?,Electric Drill,Electric Shaver,Electric Fence,Electric Heater, ,A, The Electric Drill was the invention of Arthur James Arnot. On 20 August 1889 he patented his design while working for the Union Electric Company in Melbourne. His original design was meant primarily for drilling rock to find coal! 
G.K,Misslaneous, ,Who among the following invented the small pox vaccine?,Robert Koch,Edward Jenner,Robert Hooke,Louis Pasteur, ,B," No answer description available for this question. <a href=""discussion-920"">Let us discuss</a>. "
G.K,Misslaneous, ,What George Westinghouse invented?,Light bulb,Electric razor,Refrigerator,Railway air brakes, ,D, Invented in 1868. 
G.K,Misslaneous, ,Who is the only U.S. President to invent and patent something?,Abraham Lincoln,Theodore Roosevelt,Thomas Jefferson,Rutherford B. Hayes, ,A, In 1849 Honest Abe invented a method to aid ships that got stuck on sandbars. He called it A Device for Buoying Vessels Over Shoals. It was never used. 
G.K,Misslaneous, ,What invention is credited to the Russian born American inventor Vladimir Kosma Zworykin?,Telegraph,Radio,Television,Dishwasher, ,C," Zworykin invented both the tube (iconoscope) for transmission and the receiver (kinescope) in 1923 and 1924, respectively. "
G.K,Misslaneous, ,"Benjamin Franklin was a prolific inventor. He invented the lightning rod, the Franklin stove, studied electricity, discovered the Gulf Stream, started the first library, and on and on. Among his many other inventions, what musical instrument did he invent?",Banjo,Oboe,Clarinet,Harmonium, ,D," Ben also holds a lot of firsts - first U.S. ambassador, first political cartoonist, first American philosopher, organized the first fire department, and on and on. "
G.K,Misslaneous, ,What Thomas Davenport invented?,Screw propellor,Electric streetcar,Chesterfield,Sleeping (railway) car, ,B, Invented in 1834. 
G.K,Misslaneous, ,What Elisha Otis invented?,The brake used in modern elevators,Jet Engine,Turbine,Hydraulic Crane, ,A," <p>In 1853, American inventor Elisha Otis demonstrated a freight elevator equipped with a safety device to prevent falling in case a supporting cable should break. This increased public confidence in such devices. Otis established a company for manufacturing elevators and patented (1861) a steam elevator.</p><p>Many people think that he invented the elevator, but the truth is, he invented the elevator brake. He also invented the railway safety brake.</p> "
G.K,Misslaneous, ,Where was the yo-yo invented?,France,United States,Philippines,England, ,C," The yo-yo was first used by hunters as weapons. They were wooden disks on strings. In the 1920s, a man from the U.S. named Donald Duncan made the yo-yo into a toy after he visited the Philippines. "
G.K,Misslaneous, ,For what does the world owe Almon Strowger a debt of gratitude?,Parking Meters,Vending Machines,Automatic Telephone Exchanges,Traffic Lights, ,C," He was an undertaker, and legend has it, he developed the automatic switch in 1889, to stop competitors from getting his work! "
G.K,Misslaneous, ,Who is often called the 'first African-American' inventor?,Bessie Blount,George Washington Carver,Benjamin Banneker,Elijah McCoy, ,C," Banneker was a member of the planning committee that designed Washington, DC along with Pierre L'Enfant. When L'Enfant was fired Banneker recreated the plans from memory. "
G.K,Misslaneous, ,The first hand glider was designed by...?,Leonardo DaVinci,The Wright brothers,Francis Rogallo,Galileo, ,A," No answer description available for this question. <a href=""discussion-820"">Let us discuss</a>. "
G.K,Misslaneous, ,In which decade was the telegraph invented?,1810s,1840s,1870s,1890s, ,B," On May 24, 1844, Samuel Morse send his famous message, ""What hath God wrought?"" "
G.K,Misslaneous, ,What inspired reflecting road lights to be invented?,Car door reflecting mirrors,The light a cat's eyes gave off on a fence,Sun light on steel posts on road sides,The sun light on the windshield, ,B," In 1933, Englishman Percy Shaw was driving home when he saw a cat's eyes reflecting. He had been headed straight towards a fence with the cat on it, but on the other side was a drop of hundreds of feet. "
G.K,Misslaneous, ,When were blue jeans invented?,1900s,1860s,1870s,1850s, ,D," The first blue jeans were invented by tailor Levi Strauss, who invented tougher working pants for the miners of the California Gold Rush. "
G.K,Misslaneous, ,Who invented Electric Generator?,Sir Alexander Graham Bell,Michael Faraday,Alfred B. Nobel,Thomas Alva Edison, ,B," No answer description available for this question. <a href=""discussion-819"">Let us discuss</a>. "
G.K,Misslaneous, ,What device for new parents did Ann Moore invent in 1969?,Bottle warmer,Baby monitor,Disposable diaper,Infant carrier, ,D, Ann got the idea for the Snugli infant carrier from the traditional African baby carriers she observed while a volunteer for the Peace Corps in Africa. 
G.K,Misslaneous, ,In which decade was the transistor invented?,1940s,1950s,1960s,1980s, ,A," On December 23, 1947, William Shockley, Walter Brattain and John Bardeen, of Bell Labs, announced their discovery of the point-contact germanium transistor to management. "
G.K,Misslaneous, ,What Igor Sikorsky invented?,Hydroplane,Jet engine airplane,Helicopter,Glider, ,C, Invented in 1939. 
G.K,Misslaneous, ,What Henry Bessemer invented?,Aluminum,Electroplating,Steel Converter,Steel rolling mill, ,C, Invented in 1856. 
G.K,Misslaneous, ,"What invention was first installed at a Hartford, Connecticut bank in 1889?",Automatic teller machine,Time-lock safe,Burglar alarm,Pay telephone, ,D," William Gray, inventor of the pay telephone, also invented the inflatable chest protector worn by baseball umpires and catchers. "
G.K,Misslaneous, ,Ralph Samuelson was only 18 when he invented this sporting item in 1922. What was that?,Golf tee,Motorboat,Water skis,Hang glider, ,C, The new item was first used on Lake Pepin in Minnesota. 
G.K,Misslaneous, ,Who invented Bifocal Lens?,Alfred B. Nobel,Thomas Alva Edison,Benjamin Franklin,Rudolf Diesel, ,C," No answer description available for this question. <a href=""discussion-818"">Let us discuss</a>. "
G.K,Misslaneous, ,What Karl Benz invented?,Gasoline powered automobile,Streetcar,Glider,Steam turbine, ,A, Invented in 1885. 
G.K,Misslaneous, ,When were bar code scanners invented?,1940s,1950s,1970s,1960s, ,C," The scanner reads the bar code label on something at a supermarket, and translates it into a number which the computer reads. "
G.K,Misslaneous, ,When was the game Frisbee invented?,1920s,1900s,1870s,1890s, ,C," The first Frisbees were pie tins from the Frisbie Pie Company in Connecticut. In the 1950s, the pie tins were changed to plastic plates. The name then became the Flying Saucer, but later changed to Frisbee. "
G.K,Misslaneous, ,This English inventor is known as the 'Father of Computing.',Philo Farnsworth,J. Presper Eckert,John Mauchly,Charles Babbage, ,D, Mauchly and Eckert invented the ENIAC computer. Farnsworth was a pioneer of early television. 
G.K,Misslaneous, ,Who invented Airship (rigid)?,Dr. Alan M. Turing,Roger Bacon,G. Ferdinand Von Zeppelin,Otto, ,C," No answer description available for this question. <a href=""discussion-808"">Let us discuss</a>. "
G.K,Misslaneous, ,What piece of clothing was invented by French fashion designer Louis Reard in 1946?,Zoot suit,Mini-skirt,Bikini,Tank top, ,C," The bikini, a two-piece swimsuit named for the Bikini Atoll in the Pacific, made its debut on July 5, 1946. "
G.K,Misslaneous, ,In which year was MIDI introduced?,1987,1983,1973,1977, ,B," No answer description available for this question. <a href=""discussion-806"">Let us discuss</a>. "
G.K,Misslaneous, ,In which decade was the SPICE simulator introduced?,1950s,1960s,1970s,1980s, ,C," SPICE (Simulation Program with Integrated Circuit Emphasis) was introduced in May 1972 by the University of Berkeley, California. "
G.K,Misslaneous, ,Who invented the first controllable flying AEROPLANE (AIRPLANE)?,Wright Brothers,Lidenbergh Brothers,South Brothers,West Brothers, ,A," Wilbur and Orville Wright made the first successful controlled powered flight at Kitty Hawk, North Carolina, in December 1903. The twelve second flight covered a distance of 120 feet and an altitude of just ten feet. "
G.K,Misslaneous, ,What groovy item was invented by Englishman Edward Craven Walker in 1963?,Leisure suit,Lava lamp,Eight-track tape deck,Hot comb, ,B," Groovy, baby! Lava lamps, which were a fixture in every hip pad in the 1960s and 70s, featured a mixture of water and colored oil that created swirl patterns when heated by a light bulb. "
G.K,Misslaneous, ,In which decade was the Internet first implemented?,1940s,1950s,1960s,1980s, ,C," The first message ever sent over what is now called the Internet took place at 10:30PM on October 29, 1969. Back then, the Department of Defense called it ARPAnet (Advanced Research Projects Agency network). "
G.K,Misslaneous, ,What did cardiologist Dr. Paul Zoll invent in Massachusetts in 1952?,EKG,Artificial heart valve,Artificial heart,Pacemaker, ,D, The pacemaker is an electrical device that regulates the heartbeat. 
G.K,Misslaneous, ,What Elmer A. Sperry invented?,Hydroplane,Hydraulic turbine,Magnetic compass,Gyrocompass, ,D, Invented in 1911. 
G.K,Misslaneous, ,What African-American inventor received 5 patents in the field of shoemaking?,Elijah McCoy,Jan Ernst Matzeliger,Ernest Just,Lewis Latimer, ,B, Matzeliger never benefited financially from his inventions. He died in 1889 at the age of 37 from tuberculosis. 
G.K,Misslaneous, ,It travels over land and water. Who invented the HOVERCRAFT?,S. Sperrow,O. Stricheg,T. Henman,C. Cockerell, ,D," Christopher Cockerell invented the hovercraft in 1956. His early experiments with the idea involved a cat food tin, a coffee tin and an industrial blower. "
G.K,Misslaneous, ,In which decade was the AEEE (now the IEEE) founded?,1850s,1880s,1930s,1950s, ,B," The IEEE (Institute of Electrical and Electronics Engineers) was formed in 1963 by the merger of the Institute of Radio Engineers (IRE, founded 1912) and the American Institute of Electrical Engineers (AIEE, founded 1884). "
G.K,Misslaneous, ,"What type of system did  Paul Nipkow, John Baird, and Charles Jenkins all invent?",Telephone,Early Warning,Electricity,Television, ,D, All of the inventors mentioned invented an early mechanical television system. 
G.K,Misslaneous, ,What Sir Isaac Newton invented?,Reflecting telescope,Chronometer,Microscope,Spectacles, ,A, Invented in 1668. 
G.K,Misslaneous, ,Who invented Bicycle?,Leo H Baekeland,Karl Benz,Evangelista Torricelli,Kirkpatrick Macmillan, ,D," No answer description available for this question. <a href=""discussion-809"">Let us discuss</a>. "
G.K,Misslaneous, ,In which decade with the first transatlantic radio broadcast occur?,1850s,1860s,1870s,1900s, ,D," On December 12, 1901, a radio transmission received by Guglielmo Marconi resulted in the first transmission of a transatlantic wireless signal (Morse Code) from Poldhu, Cornwall, to St. John's, Newfoundland. "
G.K,Misslaneous, ,"In the 1700s, who would pay the postage fee for letters before the stamp was invented?",The sender,There was no fee,The receiver of the letter,The post office, ,C," Later in 1840, Rowland Hill invented the stamp, which was paid for by the sender, not the receiver. "
G.K,Misslaneous, ,Who synthesized the first wholly artificial gene?,Hargobind Khorana,J.J. Thompson,Benjamin Franklin,Meghnad Saha, ,A," No answer description available for this question. <a href=""discussion-919"">Let us discuss</a>. "
G.K,Misslaneous, ,FROZEN FOOD - Who discovered the first practical method of freezing food?,C. Birdseye,F. Rozenosh,G. Findus,R. Scott, ,A," In the 1920s Clarence Birdseye discovered that if food was flash-frozen under pressure, it would freeze without the formation of ice crystals. "
G.K,Misslaneous, ,When was the Raggedy Ann doll patented?,1915,1920,1919,1911, ,A, Johnny Gruelle patented the Raggedy Ann doll in 1915. The Raggedy Andy doll and the Raggedy Ann books came later. 
G.K,Misslaneous, ,What Frank Whittle invented?,Radar,Ethyl gasoline,Sonar,Jet propulsion, ,D, Invented in 1937. 
G.K,Misslaneous, ,When was the first Lionel trains manufactured?,1920,1890,1901,1944, ,C," Joshua Lionel Cowen and Harry C. Grant started the Lionel Manufacturing Company on Sept. 5, 1900 in New York City. The first train, which was called the Electric Express, was manufactured in 1901 and was an open gondola propelled by a fan motor. As time has passed, the trains have been made in different colors and styles. "
G.K,Misslaneous, ,"What item, originally called the 'Whirlwind', was invented by Ives McGaffey in 1869?",Blender,Electric mixer,Washing machine,Vacuum cleaner, ,D," No answer description available for this question. <a href=""discussion-850"">Let us discuss</a>. "
G.K,Misslaneous, ,What office item was invented by Bette Nesmith Graham in 1951?,Fax machine,Stapler,Liquid Paper,Copy machine, ,C, Bette's other claim to fame was being the mother of Michael Nesmith of the Monkees. 
G.K,Misslaneous, ,What George Pullman invented?,Sleeping (railway) car,Airship,Box car (railway),Air brakes, ,A, Invented in 1857. 
G.K,Misslaneous, ,Who invented Bakelite?,Charles Goodyear,Leo Hendrik Baekeland,Roy Plunkett,Henry Ford, ,B, Leo Hendrik Baekeland invented the first plastic called Bakelite. 
G.K,Misslaneous, ,What toy was invented by Joshua Lionel Cowen around 1900?,Raggedy Ann doll,Yo-yo,Electric train,Tinkertoys, ,C," His middle name, Lionel, is the source of the Lionel Train brand name. "
G.K,Misslaneous, ,This African-American woman physical therapist worked with soldiers disabled in World War II. She invented a device that helped the disabled to eat by delivering food through a tube to a mouthpiece.,Bessie Blount,Marjorie Joyner,Mae Jamison,Beulah Henry, ,A," Unfortunately Blount could never get anyone to buy her invention. Finally, in 1952 she sold the rights to the French government. "
G.K,Misslaneous, ,"What invention by Garnet Carter made its debut at the Fairyland Inn Resort in Lookout Mountain, Tennessee, in 1927?",Miniature golf,Swimming pool slide,Ski lift,Golf cart, ,A, It was originally called 'Tom Thumb Golf'. 
G.K,Misslaneous, ,Who invented the phonograph?,Thomas Edison,John Kruesi,Jules Levy,Alexander Graham Bell, ,B," John Kruesi was a mechanic for Edison, and Kruesi built the phonograph. Edison designed it, and later improved the phonograph. "
G.K,Misslaneous, ,"What beverage was invented by Charles Alderton in 1885 in Waco, Texas?",Cream soda,Coca-Cola,Dr. Pepper,Sprite, ,C, The cherry-flavored cola made its debut at Morrison's Old Corner Drugstore. 
G.K,Misslaneous, ,Who invented fuel cells in 1839?,Buckminster Fuller,Sir William Grove,Sylvester Graham,Joyce Hall, ,B, Fuel cells were invented in 1839 by Sir William Grove. 
G.K,Misslaneous, ,"The ELECTRIC BATTERY, who's charged with inventing this one?",Hertz,Amper,Galvani,Volta, ,D," Italian, Alessandro Volta discovered the first practical battery in 1800. Life would be very different without batteries. "
G.K,Misslaneous, ,In which decade was the ARRL founded?,1940s,1930s,1920s,1910s, ,D," On April 6, 1914, Hiram Percy Maxim proposed the formation of the American Radio Relay League. "
G.K,Misslaneous, ,Who invented the Seed Drill?,Jethro Tull,Arlo Guthrie,Woodie Guthrie,Thomas Hines, ,A, It was invented around the early 1700's. 
G.K,Misslaneous, ,What drink was invented by Charles Leiper Grigg in 1929?,7-Up,Yoo-Hoo,Pepsi,Hawaiian Punch, ,A," Grigg, who was from Missouri, originally named his creation 'Bib-Label Lithiated Lemon-Lime Soda'. "
G.K,Misslaneous, ,For what is Charles Babbage (1792-1871) remembered?,Computers,Telescopes,Radio-Telegraphy,Steam Boating, ,A," Know as the Father of Computing. He began his 'Analytical Engine' in 1833. The first computer, although he never completed it. "
G.K,Misslaneous, ,Who invented Automobiles using gasoline?,Leo H Baekeland,Karl Benz,Evangelista Torricelli,Kirkpatrick Macmillan, ,B," No answer description available for this question. <a href=""discussion-807"">Let us discuss</a>. "
G.K,Misslaneous, ,Who invented the battery?,John Wilkinson,Alessandro Volta,James Hargreaves,Thomas Edison, ,B," He was an Italian scientist, and he invented the battery in 1800. "
G.K,Misslaneous, ,Where were wigs first invented?,Japan,France,Egypt,China, ,C," As you have noticed in pictures, many Egyptians have head coverings, sometimes with beads in them. The first wigs were created to cover the head from the hot sun. "
G.K,Misslaneous, ,Who was the first person to patent the JET ENGINE?,F. Whittle,C. Lindbergh,W. Histell,B. Owings, ,A, British inventor Frank Whittle was the first to patent his design for a jet engine in 1930. Although an engine designed by Dr. Hans Von Ohain was the first to fly in 1939. Whittle's jet engine first flew in 1941. 
G.K,Misslaneous, ,The initials JCB on earth-moving equipment are those of the founder of the company that makes it. What is his name?,John Christopher Ballantyne,Joseph Cyril Bamford,John Christopher Baxter,Jack Croxford Baker, ,B," Joseph Cyril Bamford founded the company that makes these iconic machines in 1945, in a 12ft X 15ft garage in Staffordshire. "
G.K,Misslaneous, ,What treat was invented by 11-year-old Frank Epperson in 1905?,Popsicle,Banana split,Cotton candy,Cracker Jacks, ,A, It was originally called the 'Epsicle' in his honor. (I can see why that name didn't catch on). 
G.K,Misslaneous, ,When was Milk Tray first introduced?,1915,1934,1923,1942, ,A," Milk Tray was introduced in 1915 in open boxes arranged on wooden trays. Today, with its distinctive purple and gold cartons and popularised by the ""Man in Black"" television adverts, its one of the most popular chocolate assortments. "
G.K,Misslaneous, ,When was the toothbrush invented?,1770,1765,1790,1742, ,A," The first toothbrush was made out of a bone and small brush, by jail prisoner William Addis of England. "
G.K,Misslaneous, ,"What item of apparel was invented by Ellery Chun, a Hawaiian clothing merchant, in 1931?",String bikini,Muumuu,Aloha shirt,Capri pants, ,C, An Aloha shirt is a brightly colored tropical print shirt that is a popular souvenir of Hawaii. 
G.K,Misslaneous, ,Who invented Fountain Pen?,John J. Loud,Sir Frank Whittle,Lewis E. Waterman,Kirkpatrick Macmillan, ,C," No answer description available for this question. <a href=""discussion-814"">Let us discuss</a>. "
G.K,Misslaneous, ,Ordinary table salt is sodium chloride. What is baking soda?,Potassium chloride,Potassium carbonate,Potassium hydroxide,Sodium bicarbonate, ,D," No answer description available for this question. <a href=""discussion-1359"">Let us discuss</a>. "
G.K,Misslaneous, ,Ozone hole refers to,hole in ozone layer,decrease in the ozone layer in troposphere,decrease in thickness of ozone layer in stratosphere,increase in the thickness of ozone layer in troposphere, ,C," No answer description available for this question. <a href=""discussion-1370"">Let us discuss</a>. "
G.K,Misslaneous, ,"Pine, fir, spruce, cedar, larch and cypress are the famous timber-yielding plants of which several also occur widely in the hilly regions of India. All these belong to",angiosperms,gymnosperms,monocotyledons,dicotyledons, ,B," No answer description available for this question. <a href=""discussion-1377"">Let us discuss</a>. "
G.K,Misslaneous, ,Pollination is best defined as,transfer of pollen from anther to stigma,germination of pollen grains,growth of pollen tube in ovule,visiting flowers by insects, ,A," No answer description available for this question. <a href=""discussion-1397"">Let us discuss</a>. "
G.K,Misslaneous, ,Plants receive their nutrients mainly from,chlorophyll,atmosphere,light,soil, ,D," No answer description available for this question. <a href=""discussion-1389"">Let us discuss</a>. "
G.K,Misslaneous, ,Movement of cell against concentration gradient is called,osmosis,active transport,diffusion,passive transport, ,B," Active transport, this is the only transport method that can move species against their concentration gradient (from low to high concentration). Facilitated diffusion only moves species down their concentration gradient from high to low concentration. "
G.K,Misslaneous, ,Photosynthesis generally takes place in which parts of the plant?,Leaf and other chloroplast bearing parts,stem and leaf,Roots and chloroplast bearing parts,Bark and leaf, ,A," No answer description available for this question. <a href=""discussion-1373"">Let us discuss</a>. "
G.K,Misslaneous, ,Most fish do not sink in water because of the presence of swim bladderair bladderair sacsair in spongy bones,I and II are correct,II and III are correct,III and IV are correct,"I, II, III and IV are correct", ,A," No answer description available for this question. <a href=""discussion-1335"">Let us discuss</a>. "
G.K,Misslaneous, ,Plants synthesis protein from,starch,sugar,amino acids,fatty acids, ,C," No answer description available for this question. <a href=""discussion-1390"">Let us discuss</a>. "
G.K,Misslaneous, ,Plants absorb dissolved nitrates from soil and convert them into,free nitrogen,urea,ammonia,proteins, ,A," No answer description available for this question. <a href=""discussion-1380"">Let us discuss</a>. "
