Subject,Topic,Direction,Question,Option 1,Option 2,Option 3,Option 4,Option 5,Answer,Explanation
G.K,Misslaneous, ,Under whose leadership was the all India Muslim League set up?,Mohammed Ali Jinnah,Sayyid Ahmed Khan,Aga Khan,All of the above,None of the above,C," No answer description available for this question. <a href=""discussion-71"">Let us discuss</a>. "
G.K,Misslaneous, ,"Though Ashoka had many sons, the inscriptions mentioned only one who is not mentioned in any other source. He is",Kunala,Tivara,Mahendra,Jalauka, ,B," No answer description available for this question. <a href=""discussion-45"">Let us discuss</a>. "
G.K,Misslaneous, ,We can know about early vedic period from,archaeological  excavations,the Rig Veda,Jatak Katha,contemporary culture, ,B," No answer description available for this question. <a href=""discussion-79"">Let us discuss</a>. "
G.K,Misslaneous, ,The Upanishads are,a source of Hindu philosophy,books of ancient Hindu laws,books on social behavior of man,prayers to God, ,A," No answer description available for this question. <a href=""discussion-29"">Let us discuss</a>. "
G.K,Misslaneous, ,Universities in the Presidency towns in India were established in,1857,1858,1900,1909, ,A," No answer description available for this question. <a href=""discussion-72"">Let us discuss</a>. "
G.K,Misslaneous, ,The Vijayanagara king who employed skilled archers of the Turkish clan and raised the fighting capacity of his bowmen was,Bukka I,Devaraya I,Krishnadevaraya,Ramaraya, ,B," No answer description available for this question. <a href=""discussion-38"">Let us discuss</a>. "
G.K,Misslaneous, ,"Under the Guptas in eastern India, there was probably an intermediate level of administration between vishayas (districts) and villages. Identify it.",Bhukit,Pradesa,Vithi,Ahara, ,C," No answer description available for this question. <a href=""discussion-68"">Let us discuss</a>. "
G.K,Misslaneous, ,The two principles monuments of Alaud-din Khilji's reign - the Jama at Kana Masjid and Alai Darwaza - were constructed at,Agra,Delhi,Dhar,Gulbarga, ,B," No answer description available for this question. <a href=""discussion-26"">Let us discuss</a>. "
G.K,Misslaneous, ,The term Nirgrantha is associated with,Ajivikas,Charvakas,Jainas,Pasupatas, ,C," No answer description available for this question. <a href=""discussion-7"">Let us discuss</a>. "
G.K,Misslaneous, ,The Kalinga was fought in,321 BC,301 BC,261 BC,241 BC, ,C," No answer description available for this question. <a href=""discussion-53"">Let us discuss</a>. "
G.K,Misslaneous, ,"Under the Government of India, Provincial Legislatures consisted of two chambers, except in the case of",Assam,Bihar,Madras,Punjab, ,D," No answer description available for this question. <a href=""discussion-67"">Let us discuss</a>. "
G.K,Misslaneous, ,The Venetian traveler who travelled with his wife and reached Vijayanagar around 1420 was,Athanasius Nikitin,Nicolo de Conti,Ibn Batuta,Ferishta, ,B," No answer description available for this question. <a href=""discussion-36"">Let us discuss</a>. "
G.K,Misslaneous, ,The year 788 AD was a good one for Hinduism. Why?,Shankracharya was born that year.,"Harsha Vardhana, the last Buddhist king, died.",Samudragupta converted to Hinduism.,All Muslim invaders were defeated., ,A," No answer description available for this question. <a href=""discussion-41"">Let us discuss</a>. "
G.K,Misslaneous, ,The Uprising of 1857 was described as the first Indian war of Independence by,S.N. Sen,R.C. Mazumdar,B.G. Tilak,V.D. Savakar, ,D," No answer description available for this question. <a href=""discussion-31"">Let us discuss</a>. "
G.K,Misslaneous, ,"The twenty-third Jaina teacher, Parsva, the immediate predecessor of Mahavira enjoined on his disciples four great vows. To these Mahavira addes which of the followings as the fifth vow?",Abstention from stealing,Non-injury,Brahmacharya or continence,Non-attachment, ,C," No answer description available for this question. <a href=""discussion-25"">Let us discuss</a>. "
G.K,Misslaneous, ,The Turko-Afghan rule in India lasted for about,two centuries,three centuries,four centuries,a little over one century, ,B," No answer description available for this question. <a href=""discussion-24"">Let us discuss</a>. "
G.K,Misslaneous, ,Who is the father of Geometry?,Aristotle,Euclid,Pythagoras,Kepler, ,B," No answer description available for this question. <a href=""discussion-2234"">Let us discuss</a>. "
G.K,Misslaneous, ,"What is common between Kutty, Shankar, Laxman and Sudhir Dar?",Film Direction,Drawing Cartoons,Instrumental Music,Classical Dance, ,B," No answer description available for this question. <a href=""discussion-2272"">Let us discuss</a>. "
G.K,Misslaneous, ,Who was known as Iron man of India?,Govind Ballabh Pant,Jawaharlal Nehru,Subhash Chandra Bose,Sardar Vallabhbhai Patel, ,D," No answer description available for this question. <a href=""discussion-2270"">Let us discuss</a>. "
G.K,Misslaneous, ,The Indian to beat the computers in mathematical wizardry is,Ramanujam,Rina Panigrahi,Raja Ramanna,Shakunthala Devi, ,D," No answer description available for this question. <a href=""discussion-2205"">Let us discuss</a>. "
G.K,Misslaneous, ,Jude Felix is a famous Indian player in which of the fields?,Volleyball,Tennis,Football,Hockey, ,D," No answer description available for this question. <a href=""discussion-2237"">Let us discuss</a>. "
G.K,Misslaneous, ,Who among the following was an eminent painter?,Sarada Ukil,Uday Shanker,V. Shantaram,Meherally, ,A," No answer description available for this question. <a href=""discussion-2251"">Let us discuss</a>. "
G.K,Misslaneous, ,Professor Amartya Sen is famous in which of the fields?,Biochemistry,Electronics,Economics,Geology, ,C," No answer description available for this question. <a href=""discussion-2250"">Let us discuss</a>. "
G.K,Misslaneous, ,Which of the following was Satyajit Ray associated with?,Classical music,Commercial art,Film Direction,Classical dance, ,C," No answer description available for this question. <a href=""discussion-2253"">Let us discuss</a>. "
G.K,Misslaneous, ,"Dr. Joon Lew of korea, the recipient of international Gandhi Award is known for his service in the?",Eradication of leprosy,Campaigning against AIDS,Against Drugs,Against child labour, ,A," No answer description available for this question. <a href=""discussion-2240"">Let us discuss</a>. "
G.K,Misslaneous, ,Amjad Ali Khan is associated with which of the following musical instruments?,Sarod,Veena,Violin,Sitar, ,A," No answer description available for this question. <a href=""discussion-2246"">Let us discuss</a>. "
G.K,Misslaneous, ,Guru Gopi Krishna was a maestro of which of the following dance forma?,Kuchipudi,Kathak,Manipuri,Bahratanatyam, ,B," No answer description available for this question. <a href=""discussion-2252"">Let us discuss</a>. "
G.K,Misslaneous, ,Ms. Bachendri Pal had undertaken a unique expedition for focusing attention on which of these?,One Nation one Family,The Girl Child,National Integration,Sprit of Adventure, ,D," No answer description available for this question. <a href=""discussion-2255"">Let us discuss</a>. "
G.K,Misslaneous, ,Which of the following fields A. Nageshwara Rao is associated with?,Sports,Literature,Motion Pictures,Politics, ,C," No answer description available for this question. <a href=""discussion-2254"">Let us discuss</a>. "
G.K,Misslaneous, ,Jamini Roy was a famous?,Producer,Painter,Dancer,Actor, ,B," No answer description available for this question. <a href=""discussion-2245"">Let us discuss</a>. "
G.K,Misslaneous, ,In which field 'Aachan Maharaj' has distinguished himself?,Painting,Drama,Dance,Vocal Music, ,C," No answer description available for this question. <a href=""discussion-2211"">Let us discuss</a>. "
G.K,Misslaneous, ,The name of Pierre Cardin is associated with which of the following fields?,Painting,Films,Pop Music,Fashion Designing, ,D," No answer description available for this question. <a href=""discussion-2223"">Let us discuss</a>. "
G.K,Misslaneous, ,Who is well known collector of artefacts and curios?,Wadeyar,Salar Jung,Rabindranath Tagore,Motilal Nehru, ,C," No answer description available for this question. <a href=""discussion-2262"">Let us discuss</a>. "
G.K,Misslaneous, ,Ms. Vijaya Mehta has earned distinction in which of the field?,Theatre,Film Direction,Classical Dance,Journalism, ,A," No answer description available for this question. <a href=""discussion-2247"">Let us discuss</a>. "
G.K,Misslaneous, ,Dr. M. S. Swaminathan has distinguished himself in which of the following fields?,Agriculture,Medicine,Astrophysics,Physics, ,A," No answer description available for this question. <a href=""discussion-2214"">Let us discuss</a>. "
G.K,Misslaneous, ,Satyen Bose has shown his excellence in which of the following fields?,Stage Acting,Drawing and Painting,Classical Dance,Motion Picture, ,D," Satyen Bose (22 January 1916 - 9 June 1993) was a film director from India. He has directed both Bengali and Hindi films. Among his most notable films are: Raat Aur Din, Chalti Ka Naam Gaadi, Dosti and Jagriti. Jagriti won the Filmfare Best Movie Award in 1956 and Dosti won same award in 1964. "
G.K,Misslaneous, ,Charles Correa has distinguished himself in which of the following fields?,Painting,Ballet,Architecture,Western Music, ,C," No answer description available for this question. <a href=""discussion-2207"">Let us discuss</a>. "
G.K,Misslaneous, ,Who declared that his ultimate aim was to wipe 'every tear from every eye'?,Rajendra Prasad,Sardar Patel,Jawaharlal Nehru,Mahatma Gandhi, ,C," No answer description available for this question. <a href=""discussion-2221"">Let us discuss</a>. "
G.K,Misslaneous, ,Ashok Pandit is known for his outstanding performance in which field?,Wrestling,Kabaddi,Shooting,Swimming, ,C," No answer description available for this question. <a href=""discussion-2256"">Let us discuss</a>. "
G.K,Misslaneous, ,Who among the following is a social activist campaigning against child labour?,Baba Amte,Shabana Amzi,Mira Nair,Swami Agnivesh, ,D," No answer description available for this question. <a href=""discussion-2229"">Let us discuss</a>. "
G.K,Misslaneous, ,"Pandit K. G. Ginde, was well known for his contribution in the field of?",Music,Sanskrit,Dance,Ayurveda, ,A," No answer description available for this question. <a href=""discussion-2231"">Let us discuss</a>. "
G.K,Misslaneous, ,"Who fits with this description 'Indian Cotton merchant, Banker, Congressman, a close associate of Mahatma Gandhi'?",M. R. Jayakar,V. S. Sastri,G. D. Birla,Jamanlal Bajaj, ,C," No answer description available for this question. <a href=""discussion-2222"">Let us discuss</a>. "
G.K,Misslaneous, ,Pandit Jasraj has established his reputation in which of the following fields?,Music,Literature,Sanskrit,Dance, ,A," No answer description available for this question. <a href=""discussion-2213"">Let us discuss</a>. "
G.K,Misslaneous, ,Ustad Nisar hussain Khan earned distinction in which of the following fields?,Vocal Music,Instrumental music,Acting,Classical dance, ,A," No answer description available for this question. <a href=""discussion-2271"">Let us discuss</a>. "
G.K,Misslaneous, ,R. K. Laxman is a renowned,Dance master,Writer,Cartoonist,Journalist, ,C," No answer description available for this question. <a href=""discussion-2239"">Let us discuss</a>. "
G.K,Misslaneous, ,Dr. Amiya Chakravarthy is known for his,work in the Chipko movement,composing music for Ray's films,being literary Secretary to R. N. Tagore,patenting a living organism, ,C," No answer description available for this question. <a href=""discussion-2268"">Let us discuss</a>. "
G.K,Misslaneous, ,The first woman in space was,Valentina Tereshkova,Sally Ride,Naidia Comenci,Tamara Press, ,A," Valentina Vladimirovna Tereshkova is a retired Soviet cosmonaut and the first woman to have flown in space, having been selected from more than four hundred applicants and five finalists to pilot Vostok 6 on 16 June 1963. "
G.K,Misslaneous, ,Mr. Sham Lal has done commendable work in the field of?,Journalism,Politics,Socail Service,Trade Unionism, ,A," No answer description available for this question. <a href=""discussion-2249"">Let us discuss</a>. "
G.K,Misslaneous, ,Ali Akbar plays which of the following musical instruments?,Flute,Tabla,Sitar,Sarod, ,D," No answer description available for this question. <a href=""discussion-2269"">Let us discuss</a>. "
G.K,Misslaneous, ,Professor Malcolm Adiseshaih had earned worldwide distinction in which of the fields?,Literature,Defence,Economics,Medicine, ,C," No answer description available for this question. <a href=""discussion-2217"">Let us discuss</a>. "
G.K,Misslaneous, ,Samantha Fox is associated with,Politics,Pop music,Journalism,Sports, ,B," No answer description available for this question. <a href=""discussion-2224"">Let us discuss</a>. "
G.K,Misslaneous, ,Greta Garbo is associated with,Classical dance,Literature,Journalism,Acting, ,D," No answer description available for this question. <a href=""discussion-2258"">Let us discuss</a>. "
G.K,Misslaneous, ,Who is the Flying Sikh of India?,Mohinder Singh,Joginder Singh,Ajit Pal Singh,Milkha singh, ,D," No answer description available for this question. <a href=""discussion-2274"">Let us discuss</a>. "
G.K,Misslaneous, ,Ben kingsley is associated with which of the following fields?,Politics,Social Service,Sports,Motion Pictures, ,D," No answer description available for this question. <a href=""discussion-2216"">Let us discuss</a>. "
G.K,Misslaneous, ,In which of the following dance forms 'Guru Kelucharan Mohapatra' is associated with?,Odissi,Bharathanatiyam,Kathak,Kathakali, ,A," Guru Kelucharan Mohapatra (January 26, 1924 - April 7, 2004) was an Indian classical dancer, guru and proponent of Odissi dance, who is credited for the revival of the classical dance form in the 20th century. "
G.K,Misslaneous, ,Bismillah Khan was associated with?,Sarod,Shehnai,Flute,Tabla, ,B," No answer description available for this question. <a href=""discussion-2264"">Let us discuss</a>. "
G.K,Misslaneous, ,Who among the following is not a dramatist?,Girish R. Karnad,Badal Sircar,Jayanta Mahapatra,Vijay Tendulkar, ,C," No answer description available for this question. <a href=""discussion-2259"">Let us discuss</a>. "
G.K,Misslaneous, ,Who headed the committee on 'computerisation' in Indian Banks(1988)?,C. Rangarajan,R.N. Malhotra,S. Venkitramanan,M.Narasimhan, ,A," No answer description available for this question. <a href=""discussion-2215"">Let us discuss</a>. "
G.K,Misslaneous, ,Who is the famous Sarod player?,Hari Prasad,Zakir Hussain,Ram Narain,Amjad Ali Khan, ,D," No answer description available for this question. <a href=""discussion-2220"">Let us discuss</a>. "
G.K,Misslaneous, ,"Sanjay Dutt, a noted film actor was held under",TADA,Narcotics Act,Act 302,Anti - Defection Act, ,A," No answer description available for this question. <a href=""discussion-2275"">Let us discuss</a>. "
G.K,Misslaneous, ,Shovna Narayan is a reputed personality in which of the following fields?,Classical dance,Literature,Journalism,Classical music, ,A," No answer description available for this question. <a href=""discussion-2248"">Let us discuss</a>. "
G.K,Misslaneous, ,Hari Prasad Chaurasia is a renowned player of,Sitar,Flute,Sarod,Tabla, ,B," No answer description available for this question. <a href=""discussion-2208"">Let us discuss</a>. "
G.K,Misslaneous, ,Graham Green was associated with which of the fields?,Science,Music,Painting,Literature, ,D," No answer description available for this question. <a href=""discussion-2266"">Let us discuss</a>. "
G.K,Misslaneous, ,Dr. V. Kurien is famous in the field of ?,Atomic Power,poultry farms,Dairy development,Economic Reforms, ,C," No answer description available for this question. <a href=""discussion-2241"">Let us discuss</a>. "
G.K,Misslaneous, ,Which of the following pairs of artists and their areas of specialization is not correct?,Pt. Ravi Shankar - Sitar,M. S. Subbulakshmi - Dance,Hari Prasad Chaurasia - Flute,Ustad Zakir Hussain Khan - Tabla, ,B," No answer description available for this question. <a href=""discussion-2204"">Let us discuss</a>. "
G.K,Misslaneous, ,"Miss Universe 1994, Ms. Sushmita Sen hails from which of the following cities?",Mumbai,Chandigarh,New Delhi,Bangalore, ,C," No answer description available for this question. <a href=""discussion-2232"">Let us discuss</a>. "
G.K,Misslaneous, ,Who is Tania Sachdev?,Chess player,Cricketer,Actress,Dancer, ,A," No answer description available for this question. <a href=""discussion-2263"">Let us discuss</a>. "
G.K,Misslaneous, ,Limba Ram is associated in which fields?,Sports,Politics,Social Service,Motion Picture, ,A," No answer description available for this question. <a href=""discussion-2228"">Let us discuss</a>. "
G.K,Misslaneous, ,Ms. Meera Sahib Fathima Beevi is distinguished as the first lady,Prime minister of Bangladesh,Judge of Supreme Court,Judge of the High court,Governor of a state, ,B," No answer description available for this question. <a href=""discussion-2230"">Let us discuss</a>. "
G.K,Misslaneous, ,Who is the creator of the Rock Garden in Chandigarh?,Pupal Jayakar,Le Corbousier,Glen,Nek Chand, ,D," No answer description available for this question. <a href=""discussion-2238"">Let us discuss</a>. "
G.K,Misslaneous, ,Hitendra Desai was famous in the which field?,Social Service,Journalism,Politics,Literature, ,C," No answer description available for this question. <a href=""discussion-2265"">Let us discuss</a>. "
G.K,Misslaneous, ,"Naina Devi, was associated with field of?",Social Service,Stage acting,Classical dance,Vocal music, ,D," No answer description available for this question. <a href=""discussion-2244"">Let us discuss</a>. "
G.K,Misslaneous, ,Who is known as 'Trimurthy of Carnatic Music'?,Muthuswami Dikshitar,Purandardasa,Swami Thirunal,None of these, ,A," Three great saint composers - Thyagaraja, Muthuswami Dikshitar and Shyama Sastri are known as the 'Trimurti' of Carnatic music. They were not only contemporaries during the later half of the 18th century and the beginning of the 19th century, but were also, incredibly, born in the same town of Thiruvarur in the Thanjavur district of Tamil Nadu. "
G.K,Misslaneous, ,Gangubai hangal is the name associated with,Literature,Music,Journalism,Environment, ,B," No answer description available for this question. <a href=""discussion-2219"">Let us discuss</a>. "
G.K,Misslaneous, ,Who is known as the 'Lady with the Lamp'?,Florence Nightingale,Sarojini Naidu,Indira Gandhi,Joan of Arc, ,A," No answer description available for this question. <a href=""discussion-2206"">Let us discuss</a>. "
G.K,Misslaneous, ,Girilal Jain was a noted figure in which of the following fields?,Social Service,Journalism,Literature,Politics, ,B," No answer description available for this question. <a href=""discussion-2210"">Let us discuss</a>. "
G.K,Misslaneous, ,Who is Larry Pressler?,Politician,Painter,Actor,Tennis player, ,A," No answer description available for this question. <a href=""discussion-2267"">Let us discuss</a>. "
G.K,Misslaneous, ,"Pandit Vishwa Mohan Bhatt, who has won the prestigious 'Grammy Awards' is an exponent in which of the following musical instruments?",Guitar,Violin,sarod,Tabla, ,A," No answer description available for this question. <a href=""discussion-2225"">Let us discuss</a>. "
G.K,Misslaneous, ,"Raja Ravi Verma, was famous in which of the fields?",Painting,Politics,Dance,Music, ,A," No answer description available for this question. <a href=""discussion-2235"">Let us discuss</a>. "
G.K,Misslaneous, ,Who is known as 'Desert Fox'?,Bismarck,Eisenhower,Gen. Rommel,Walter Scott, ,C," No answer description available for this question. <a href=""discussion-2257"">Let us discuss</a>. "
G.K,Misslaneous, ,The title of 'sparrow' given to,Napoleon,Major General Rajinder Singh,T. T. Krishnamachari,Sardar Patel, ,B," No answer description available for this question. <a href=""discussion-2273"">Let us discuss</a>. "
G.K,Misslaneous, ,Who headed the first scientific group to leave for Antarctica in 1982?,Dr. D.R. Sengupta,Dr. S.Z. Kasim,Dr. V. K. Raina,Dr. H. K. Gupta, ,B," No answer description available for this question. <a href=""discussion-2218"">Let us discuss</a>. "
G.K,Misslaneous, ,Which among the famous danseuses is not an exponent of the Odissi dance style?,Sanjukta Panigrahi,Madhavi Mudgal,Sonal Man Singh,Yamini Krishnamurthy, ,D," No answer description available for this question. <a href=""discussion-2227"">Let us discuss</a>. "
G.K,Misslaneous, ,Michael Jackson is a distinguished person in the field of?,Pop Music,Jounalism,Sports,Acting, ,A," No answer description available for this question. <a href=""discussion-2233"">Let us discuss</a>. "
G.K,Misslaneous, ,Ms Kim Campbell is the first woman Prime Minister of,Portugal,Canada,Switzerland,Congo, ,B," No answer description available for this question. <a href=""discussion-2226"">Let us discuss</a>. "
G.K,Misslaneous, ,The first Indian to swim across English channel was,V. Merchant,P. K. Banerji,Mihir Sen,Arati Saha, ,C," No answer description available for this question. <a href=""discussion-2243"">Let us discuss</a>. "
G.K,Misslaneous, ,Who is known as 'Indian Bismarck'?,Kamaraj,Sardar Vallabhbhai Patel,Nehru,Rajaji, ,B," No answer description available for this question. <a href=""discussion-2242"">Let us discuss</a>. "
G.K,Misslaneous, ,Radiocarbon is produced in the atmosphere as a result of,collision between fast neutrons and nitrogen nuclei present in the atmosphere,action of ultraviolet light from the sun on atmospheric oxygen,action of solar radiations particularly cosmic rays on carbon dioxide present in the atmosphere,lightning discharge in atmosphere, ,A," No answer description available for this question. <a href=""discussion-778"">Let us discuss</a>. "
G.K,Misslaneous, ,It is easier to roll a stone up a sloping road than to lift it vertical upwards because,work done in rolling is more than in lifting,work done in lifting the stone is equal to rolling it,work done in both is same but the rate of doing work is less in rolling,work done in rolling a stone is less than in lifting it, ,D," No answer description available for this question. <a href=""discussion-728"">Let us discuss</a>. "
G.K,Misslaneous, ,The absorption of ink by blotting paper involves,viscosity of ink,capillary action phenomenon,diffusion of ink through the blotting,siphon action, ,B," No answer description available for this question. <a href=""discussion-794"">Let us discuss</a>. "
G.K,Misslaneous, ,Siphon will fail to work if,the densities of the liquid in the two vessels are equal,the level of the liquid in the two vessels are at the same height,both its limbs are of unequal length,the temperature of the liquids in the two vessels are the same, ,B," No answer description available for this question. <a href=""discussion-784"">Let us discuss</a>. "
G.K,Misslaneous, ,"Large transformers, when used for some time, become very hot and are cooled by circulating oil. The heating of the transformer is due to",the heating effect of current alone,hysteresis loss alone,both the heating effect of current and hysteresis loss,intense sunlight at noon, ,C," No answer description available for this question. <a href=""discussion-733"">Let us discuss</a>. "
G.K,Misslaneous, ,Nuclear sizes are expressed in a unit named,Fermi,angstrom,newton,tesla, ,A," <p>Fermi - A unit of length equal to 10<sup>-15</sup> meter (one femtometer), used in nuclear physics. It is similar to the diameter of a proton.</p> "
G.K,Misslaneous, ,Light year is a unit of,time,distance,light,intensity of light, ,B," No answer description available for this question. <a href=""discussion-739"">Let us discuss</a>. "
G.K,Misslaneous, ,Mirage is due to,unequal heating of different parts of the atmosphere,magnetic disturbances in the atmosphere,depletion of ozone layer in the atmosphere,equal heating of different parts of the atmosphere, ,A," No answer description available for this question. <a href=""discussion-749"">Let us discuss</a>. "
G.K,Misslaneous, ,Light from the Sun reaches us in nearly,2 minutes,4 minutes,8 minutes,16 minutes, ,C," No answer description available for this question. <a href=""discussion-737"">Let us discuss</a>. "
G.K,Misslaneous, ,Stars appears to move from east to west because,all stars move from east to west,the earth rotates from west to east,the earth rotates from east to west,the background of the stars moves from west to east, ,B," No answer description available for this question. <a href=""discussion-795"">Let us discuss</a>. "
G.K,Misslaneous, ,Pa(Pascal) is the unit for,thrust,pressure,frequency,conductivity, ,B," No answer description available for this question. <a href=""discussion-769"">Let us discuss</a>. "
G.K,Misslaneous, ,Planets do not twinkle because,they emit light of a constant intensity,their distance from the earth does not  change with time,they are very far away from the earth resulting in decrease in intensity of light,"they are nearer to earth and hence we receive a greater amount of light and, therefore minor variations in the intensity are not noticeable", ,D," No answer description available for this question. <a href=""discussion-773"">Let us discuss</a>. "
G.K,Misslaneous, ,Metals are good conductors of electricity because,they contain free electrons,the atoms are lightly packed,they have high melting point,All of the above, ,A," No answer description available for this question. <a href=""discussion-746"">Let us discuss</a>. "
