Subject,Topic,Direction,Question,Option 1,Option 2,Option 3,Option 4,Option 5,Answer,Explanation
G.K,Misslaneous, ,"Grand Central Terminal, Park Avenue, New York is the world's",largest railway station,highest railway station,longest railway station,None of the above, ,A," <p>For more details, Refer:</p><p><a target=""_blank"" href=""http://en.wikipedia.org/wiki/Grand_Central_Terminal"">http://en.wikipedia.org/wiki/Grand_Central_Terminal</a></p> "
G.K,Misslaneous, ,Entomology is the science that studies,Behavior of human beings,Insects,The origin and history of technical and scientific terms,The formation of rocks, ,B, Entomology: The branch of zoology concerned with the study of insects. 
G.K,Misslaneous, ,"Eritrea, which became the 182nd member of the UN in 1993, is in the continent of",Asia,Africa,Europe,Australia, ,B," No answer description available for this question. <a href=""discussion-337"">Let us discuss</a>. "
G.K,Misslaneous, ,Garampani sanctuary is located at,"Junagarh, Gujarat","Diphu, Assam","Kohima, Nagaland","Gangtok, Sikkim", ,B," No answer description available for this question. <a href=""discussion-376"">Let us discuss</a>. "
G.K,Misslaneous, ,For which of the following disciplines is Nobel Prize awarded?,Physics and Chemistry,Physiology or Medicine,"Literature, Peace and Economics",All of the above, ,D," No answer description available for this question. <a href=""discussion-366"">Let us discuss</a>. "
G.K,Misslaneous, ,Hitler party which came into power in 1933 is known as,Labour Party,Nazi Party,Ku-Klux-Klan,Democratic Party, ,B," No answer description available for this question. <a href=""discussion-399"">Let us discuss</a>. "
G.K,Misslaneous, ,Brass gets discoloured in air because of the presence of which of the following gases in air?,Oxygen,Hydrogen sulphide,Carbon dioxide,Nitrogen, ,B," No answer description available for this question. <a href=""discussion-2645"">Let us discuss</a>. "
G.K,Misslaneous, ,Which of the following is a non metal that remains liquid at room temperature?,Phosphorous,Bromine,Chlorine,Helium, ,B," No answer description available for this question. <a href=""discussion-2597"">Let us discuss</a>. "
G.K,Misslaneous, ,Chlorophyll is a naturally occurring chelate compound in which central metal is,copper,magnesium,iron,calcium, ,B," No answer description available for this question. <a href=""discussion-2610"">Let us discuss</a>. "
G.K,Misslaneous, ,Which of the following is used in pencils?,Graphite,Silicon,Charcoal,Phosphorous, ,A," No answer description available for this question. <a href=""discussion-2609"">Let us discuss</a>. "
G.K,Misslaneous, ,Which of the following metals forms an amalgam with other metals?,Tin,Mercury,Lead,Zinc, ,B," No answer description available for this question. <a href=""discussion-2600"">Let us discuss</a>. "
G.K,Misslaneous, ,Chemical formula for water is,NaAlO2,H2O,Al2O3,CaSiO3, ,B," No answer description available for this question. <a href=""discussion-2615"">Let us discuss</a>. "
G.K,Misslaneous, ,The gas usually filled in the electric bulb is,nitrogen,hydrogen,carbon dioxide,oxygen, ,A," No answer description available for this question. <a href=""discussion-2616"">Let us discuss</a>. "
G.K,Misslaneous, ,Washing soda is the common name for,Sodium carbonate,Calcium bicarbonate,Sodium bicarbonate,Calcium carbonate, ,A," <p><b>What is the scientific name for washing soda?</b></p><p>Sodium carbonate (also known as washing soda or soda ash), Na2CO3 is a sodium salt of carbonic acid.</p><p><b>Scientific name for baking soda?</b></p><p>Sodium bicarbonate or sodium hydrogen carbonate is the chemical compound with the formula NaHCO3. Sodium bicarbonate is a white solid that is crystalline but often appears as a fine powder. Since it has long been known and is widely used, the salt has many related names such as baking soda, bread soda, cooking soda, and bicarbonate of soda.</p> "
G.K,Misslaneous, ,Quartz crystals normally used in quartz clocks etc. is chemically,silicon dioxide,germanium oxide,a mixture of germanium oxide and silicon dioxide,sodium silicate, ,A," No answer description available for this question. <a href=""discussion-2646"">Let us discuss</a>. "
G.K,Misslaneous, ,Which of the gas is not known as green house gas?,Methane,Nitrous oxide,Carbon dioxide,Hydrogen, ,D," <p>In order, the most abundant greenhouse gases in Earth's atmosphere are:<br><br>* water vapor<br>* carbon dioxide<br>* methane<br>* nitrous oxide<br>* ozone<br>* chlorofluorocarbons</p> "
G.K,Misslaneous, ,Bromine is a,black solid,red liquid,colourless gas,highly inflammable gas, ,B," No answer description available for this question. <a href=""discussion-2604"">Let us discuss</a>. "
G.K,Misslaneous, ,The hardest substance available on earth is,Gold,Iron,Diamond,Platinum, ,C," No answer description available for this question. <a href=""discussion-2636"">Let us discuss</a>. "
G.K,Misslaneous, ,The variety of coal in which the deposit contains recognisable traces of the original plant material is,bitumen,anthracite,lignite,peat, ,D," No answer description available for this question. <a href=""discussion-2649"">Let us discuss</a>. "
G.K,Misslaneous, ,Tetraethyl lead is used as,pain killer,fire extinguisher,mosquito repellent,petrol additive, ,D," No answer description available for this question. <a href=""discussion-2596"">Let us discuss</a>. "
G.K,Misslaneous, ,Which of the following is used as a lubricant?,Graphite,Silica,Iron Oxide,Diamond, ,A," No answer description available for this question. <a href=""discussion-2622"">Let us discuss</a>. "
G.K,Misslaneous, ,"The inert gas which is substituted for nitrogen in the air used by deep sea divers for breathing, is",Argon,Xenon,Helium,Krypton, ,C," No answer description available for this question. <a href=""discussion-2641"">Let us discuss</a>. "
G.K,Misslaneous, ,The gases used in different types of welding would include,oxygen and hydrogen,"oxygen, hydrogen, acetylene and nitrogen","oxygen, acetylene and argon",oxygen and acetylene, ,D," No answer description available for this question. <a href=""discussion-2618"">Let us discuss</a>. "
G.K,Misslaneous, ,The property of a substance to absorb moisture from the air on exposure is called,osmosis,deliquescence,efflorescence,desiccation, ,B," No answer description available for this question. <a href=""discussion-2644"">Let us discuss</a>. "
G.K,Misslaneous, ,In which of the following activities silicon carbide is used?,Making cement and glass,Disinfecting water of ponds,cutting very hard substances,Making casts for statues, ,C," No answer description available for this question. <a href=""discussion-2594"">Let us discuss</a>. "
G.K,Misslaneous, ,The average salinity of sea water is,3%,3.50%,2.50%,2%, ,B," No answer description available for this question. <a href=""discussion-2638"">Let us discuss</a>. "
G.K,Misslaneous, ,"When an iron nail gets rusted, iron oxide is formed",without any change in the weight of the nail,with decrease in the weight of the nail,with increase in the weight of the nail,without any change in colour or weight of the nail, ,C," No answer description available for this question. <a href=""discussion-2634"">Let us discuss</a>. "
G.K,Misslaneous, ,Galvanised iron sheets have a coating of,lead,chromium,zinc,tin, ,C," No answer description available for this question. <a href=""discussion-2625"">Let us discuss</a>. "
G.K,Misslaneous, ,"Among the various allotropes of carbon,","coke  is the hardest, graphite is the softest","diamond is the hardest, coke is the softest","diamond is the hardest, graphite is the softest","diamond is the hardest, lamp black is the softest", ,C," No answer description available for this question. <a href=""discussion-2626"">Let us discuss</a>. "
G.K,Misslaneous, ,"The group of metals Fe, Co, Ni may best called as",transition metals,main group metals,alkali metals,rare metals, ,A," No answer description available for this question. <a href=""discussion-2642"">Let us discuss</a>. "
G.K,Misslaneous, ,Heavy water is,deuterium oxide,PH7,rain water,tritium oxide, ,A," No answer description available for this question. <a href=""discussion-2617"">Let us discuss</a>. "
G.K,Misslaneous, ,The chemical (ethyl mercaptan) added to the otherwise odourless LPG cooking gas for imparting a detectable smell to the gas is a compound of,bromine,fluorine,chlorine,sulphur, ,D," No answer description available for this question. <a href=""discussion-2640"">Let us discuss</a>. "
G.K,Misslaneous, ,The element common to all acids is,hydrogen,carbon,sulphur,oxygen, ,A," No answer description available for this question. <a href=""discussion-2595"">Let us discuss</a>. "
G.K,Misslaneous, ,Non stick cooking utensils are coated with,Teflon,PVC,black paint,polystyrene, ,A," No answer description available for this question. <a href=""discussion-2605"">Let us discuss</a>. "
G.K,Misslaneous, ,Monazite is an ore of,titanium,zirconium,iron,thorium, ,D," No answer description available for this question. <a href=""discussion-2632"">Let us discuss</a>. "
G.K,Misslaneous, ,"Carbon, diamond and graphite are together called",allotropes,isomers,isomorphs,isotopes, ,A," No answer description available for this question. <a href=""discussion-2624"">Let us discuss</a>. "
G.K,Misslaneous, ,Potassium nitrate is used in,medicine,fertiliser,salt,glass, ,B," No answer description available for this question. <a href=""discussion-2620"">Let us discuss</a>. "
G.K,Misslaneous, ,Permanent hardness of water may be removed by the addition of,sodium carbonate,alum,potassium permanganate,lime, ,A," No answer description available for this question. <a href=""discussion-2619"">Let us discuss</a>. "
G.K,Misslaneous, ,Soda water contains,carbonic acid,sulphuric acid,carbon dioxide,nitrous acid, ,C," No answer description available for this question. <a href=""discussion-2629"">Let us discuss</a>. "
G.K,Misslaneous, ,The most important ore of aluminium is,galena,calamine,calcite,bauxite, ,D, Bauxite is an aluminium ore and is the main source of aluminium. 
G.K,Misslaneous, ,Most soluble in water is,camphor,sulphur,common salt,sugar, ,D," No answer description available for this question. <a href=""discussion-2602"">Let us discuss</a>. "
G.K,Misslaneous, ,Which of the following was to be discovered first in the chromospheres of the sun?,Krypton,Xenon,Neon,Helium, ,D," No answer description available for this question. <a href=""discussion-2651"">Let us discuss</a>. "
G.K,Misslaneous, ,Which of the following is in liquid form at room temperature?,Lithium,Sodium,Francium,Cerium, ,C," No answer description available for this question. <a href=""discussion-2628"">Let us discuss</a>. "
G.K,Misslaneous, ,Sodium metal is kept under,petrol,alcohol,water,kerosene, ,D," No answer description available for this question. <a href=""discussion-2603"">Let us discuss</a>. "
G.K,Misslaneous, ,Which of the following are the ingredients of gun metal?,"Iron, Zinc, Titanium","Iron, tin","Iron, Brass, Tin","Copper, Tin", ,D," No answer description available for this question. <a href=""discussion-2648"">Let us discuss</a>. "
G.K,Misslaneous, ,From which mineral is radium obtained?,Rutile,Haematite,Limestone,Pitchblende, ,D," No answer description available for this question. <a href=""discussion-2598"">Let us discuss</a>. "
G.K,Misslaneous, ,What is laughing gas?,Nitrous Oxide,Carbon monoxide,Sulphur dioxide,Hydrogen peroxide, ,A," No answer description available for this question. <a href=""discussion-2599"">Let us discuss</a>. "
G.K,Misslaneous, ,Actinides are the elements with atomic numbers from,97 to 104,101 to 115,89 to 103,36 from 43, ,C," No answer description available for this question. <a href=""discussion-2637"">Let us discuss</a>. "
G.K,Misslaneous, ,The two elements that are frequently used for making transistors are,boron and aluminium,silicon and germanium,iridium and tungsten,niobium and columbium, ,B," No answer description available for this question. <a href=""discussion-2613"">Let us discuss</a>. "
G.K,Misslaneous, ,The filament of an electric bulb is made of,tungsten,nichrome,graphite,iron, ,A," No answer description available for this question. <a href=""discussion-2612"">Let us discuss</a>. "
G.K,Misslaneous, ,Diamond is an allotropic form of,germanium,carbon,silicon,sulphur, ,B," No answer description available for this question. <a href=""discussion-2590"">Let us discuss</a>. "
G.K,Misslaneous, ,"In fireworks, the green flame is produced because of",sodium,barium,mercury,potassium, ,B," No answer description available for this question. <a href=""discussion-2650"">Let us discuss</a>. "
G.K,Misslaneous, ,Permanent hardness of water can be removed by adding,chlorine,washing soda,potassium permanganate,bleaching powder, ,B," No answer description available for this question. <a href=""discussion-2606"">Let us discuss</a>. "
G.K,Misslaneous, ,Marsh gas is,nitrogen,ethane,methane,hydrogen, ,C," No answer description available for this question. <a href=""discussion-2623"">Let us discuss</a>. "
G.K,Misslaneous, ,LPG consists of mainly,"methane, ethane and hexane","ethane, hexane and nonane","methane, hexane and nonane","methane, butane and propane", ,D," No answer description available for this question. <a href=""discussion-2627"">Let us discuss</a>. "
G.K,Misslaneous, ,Air is a/an,compound,element,electrolyte,mixture, ,D," No answer description available for this question. <a href=""discussion-2591"">Let us discuss</a>. "
G.K,Misslaneous, ,"Production of chlorofluorocarbons (CFC) gas which is proposed to be banned in  India, is used in which of the following domestic products?",Television,Refrigerator,Tube light,Cooking gas, ,B," No answer description available for this question. <a href=""discussion-2593"">Let us discuss</a>. "
G.K,Misslaneous, ,Balloons are filled with,nitrogen,helium,oxygen,argon, ,B," No answer description available for this question. <a href=""discussion-2592"">Let us discuss</a>. "
G.K,Misslaneous, ,Which of the following does not contain a coinage metal?,Silver and Gold,Zinc and Gold,Copper and Silver,Copper and Gold, ,B," No answer description available for this question. <a href=""discussion-2608"">Let us discuss</a>. "
G.K,Misslaneous, ,Which metal pollute the air of a big city?,Copper,Chromium,Lead,Cadmium, ,C," No answer description available for this question. <a href=""discussion-2631"">Let us discuss</a>. "
G.K,Misslaneous, ,Bell metal is an alloy of,nickel and copper,zinc and copper,brass and nickel,tin and copper, ,D," No answer description available for this question. <a href=""discussion-2647"">Let us discuss</a>. "
G.K,Misslaneous, ,Water is a good solvent of ionic salts because,it has a high specific heat,it has no colour,it has a high dipole moment,it has a high boiling point, ,C," No answer description available for this question. <a href=""discussion-2635"">Let us discuss</a>. "
G.K,Misslaneous, ,Which of the following is not an isotope of hydrogen?,Tritium,Deuterium,Protium,Yttrium, ,D, http://en.wikipedia.org/wiki/Isotopes_of_hydrogen 
G.K,Misslaneous, ,The main constituents of pearls are,calcium oxide and ammonium chloride,calcium carbonate and magnesium carbonate,aragonite and conchiolin,ammonium sulphate and sodium carbonate, ,B," No answer description available for this question. <a href=""discussion-2639"">Let us discuss</a>. "
G.K,Misslaneous, ,Amalgams are,highly coloured alloys,alloys which contain mercury as one of the contents,alloys which have great resistance to abrasion,alloys which contain carbon, ,B," No answer description available for this question. <a href=""discussion-2643"">Let us discuss</a>. "
G.K,Misslaneous, ,Which of the following is the lightest metal?,Mercury,Lithium,Lead,Silver, ,B," No answer description available for this question. <a href=""discussion-2588"">Let us discuss</a>. "
G.K,Misslaneous, ,Which of the following metals remain in liquid for under normal conditions?,Radium,Zinc,Uranium,Mercury, ,D," No answer description available for this question. <a href=""discussion-2621"">Let us discuss</a>. "
G.K,Misslaneous, ,"Potassium Permanganate is used for purifying drinking water, because",it is a sterilising agent,it dissolves the impurities of water,it is a reducing agent,it is an oxidising agent, ,D," No answer description available for this question. <a href=""discussion-2633"">Let us discuss</a>. "
G.K,Misslaneous, ,Which of the following is an element?,Ruby,Sapphire,Emerald,Diamond, ,D," No answer description available for this question. <a href=""discussion-2601"">Let us discuss</a>. "
G.K,Misslaneous, ,The Parliament of India cannot be regarded as a sovereign body because,it can legislate only on subjects entrusted to the Centre by the Constitution,it has to operate within the limits prescribed by the Constitution,the Supreme Court can declare laws passed by parliament as unconstitutional if they contravene the provisions of the Constitution,All of the above, ,D," No answer description available for this question. <a href=""discussion-127"">Let us discuss</a>. "
G.K,Misslaneous, ,"The name of the Laccadive, Minicoy and Amindivi islands was changed to Lakshadweep by an Act of Parliament in",1970,1971,1972,1973, ,D," No answer description available for this question. <a href=""discussion-105"">Let us discuss</a>. "
G.K,Misslaneous, ,The members of the Rajya Sabha are elected by,the people,Lok Sabha,elected members of the legislative assembly,elected members of the legislative council, ,C," <p>Members of Rajya Sabha are elected by the elected members of the Assemblies of States and Union territories in accordance with the system of proportional representation by means of the single transferable vote.</p><p>Ref: <a href=""http://rajyasabha.nic.in/rsnew/faq/freaq1.asp"" target=""_blank"">http://rajyasabha.nic.in/rsnew/faq/freaq1.asp</a></p> "
G.K,Misslaneous, ,The members of the panchayat are,nominated by the district officer,the electorates of the respective territorial constituencies,nominated by local self-government minister of the state,nominated by the block development organization, ,B," The Members of Gram Panchayats, Panch of Gram Kutchahry, Members of Panchayat Samiti and Zila Parishad are elected directly by the electorates of the respective territorial constituencies through universal adult franchise. "
G.K,Misslaneous, ,The power to decide an election petition is vested in the,Parliament,Supreme Court,High courts,Election Commission, ,C," No answer description available for this question. <a href=""discussion-137"">Let us discuss</a>. "
G.K,Misslaneous, ,The present Lok Sabha is the,14th Lok Sabha,15th Lok Sabha,16th Lok Sabha,17th Lok Sabha, ,D," No answer description available for this question. <a href=""discussion-150"">Let us discuss</a>. "
G.K,Misslaneous, ,The Parliament of India can make use of the residuary powers,at all times,only during national emergency,during national emergency as well as constitutional emergency as well in a state,None of the above, ,A," No answer description available for this question. <a href=""discussion-126"">Let us discuss</a>. "
G.K,Misslaneous, ,The members of Lok Sabha hold office for a term of,4 years,5 years,6 years,3 years, ,B," No answer description available for this question. <a href=""discussion-83"">Let us discuss</a>. "
G.K,Misslaneous, ,"The Parliament exercises control over council of ministers, the real executive, in several ways. Which one of the following has been wrongly listed as a method of control over executive?",Questions,Supplementary questions,Adjournment motions,None of the above, ,D," No answer description available for this question. <a href=""discussion-125"">Let us discuss</a>. "
G.K,Misslaneous, ,The number of writs that can be prayed for and issued by the Supreme Court and/or a High Court is,3,4,5,6, ,C," No answer description available for this question. <a href=""discussion-111"">Let us discuss</a>. "
G.K,Misslaneous, ,The minimum age to qualify for election to the Lok Sabha is,25 years,21 years,18 years,35 years, ,A," No answer description available for this question. <a href=""discussion-100"">Let us discuss</a>. "
G.K,Misslaneous, ,The pension of a high court judge is charged to the,Consolidated Fund of India,Consolidated Fund of the state where he last served,Consolidated Funds of the different states where he has served,Contingency Fund of India, ,A," No answer description available for this question. <a href=""discussion-129"">Let us discuss</a>. "
G.K,Misslaneous, ,The preamble says that the state in India will assure the dignity of the individual. The constitution seeks to achieve this object by guaranteeing,equal fundamental rights to each citizen,the right to adequate means of livelihood to each individual,just and humane conditions of work to each individual,equal wages for equal work to each individual irrespective of sex, ,A," No answer description available for this question. <a href=""discussion-145"">Let us discuss</a>. "
G.K,Misslaneous, ,The minimum age of the voter in India is,15 years,18 years,21 years,25 years, ,B," No answer description available for this question. <a href=""discussion-97"">Let us discuss</a>. "
G.K,Misslaneous, ,The members of a State Commission can be removed by the,governor on a report by the Supreme Court,governor on a resolution passed by Parliament,president on a report by the Supreme Court,president on a resolution passed by Parliament, ,C," No answer description available for this question. <a href=""discussion-82"">Let us discuss</a>. "
G.K,Misslaneous, ,The members of the Rajya Sabha are,directly elected by the people on the basis of universal adult franchise,elected by the members of the state legislative assemblies,elected by the members of the state legislative councils,elected by the members of the state legislative councils and state legislative assemblies, ,B, Members of Rajya Sabha are elected by the elected members of the Assemblies of States and Union territories in accordance with the system of proportional representation by means of the single transferable vote. 
G.K,Misslaneous, ,The president addresses both the Houses of Parliament assembled together,during emergency session summoned for the purpose,every session,first session after each general election and the first session of each year,any session, ,C," No answer description available for this question. <a href=""discussion-151"">Let us discuss</a>. "
G.K,Misslaneous, ,The president can dissolve the Lok Sabha on,advice of the prime minister,advice of the chief justice of India,recommendation of Lok Sabha,recommendation of the Rajya Sabha, ,A," No answer description available for this question. <a href=""discussion-157"">Let us discuss</a>. "
G.K,Misslaneous, ,The president can expend out of the Contingency Fund of India,only with the approval of the Parliament,without the approval of the Parliament,only in the case of the national calamities,None of the above, ,B," No answer description available for this question. <a href=""discussion-158"">Let us discuss</a>. "
G.K,Misslaneous, ,The pre-requisite for the enforcement of directive principles of the state policy is,"an effective, hones government",socialist government,active opposition,adequate resources, ,D," No answer description available for this question. <a href=""discussion-149"">Let us discuss</a>. "
G.K,Misslaneous, ,The Objectives Resolution which laid down the main objectives to guide the deliberations of the Assembly was moved by,Sardar Patel,Jawaharlal Nehru,K.M. Munshi,B.R. Ambedkar, ,B," No answer description available for this question. <a href=""discussion-117"">Let us discuss</a>. "
G.K,Misslaneous, ,"The president can advance money to meet unforeseen expenses, pending authorization by Parliament, from",the Consolidated Fund of India,the Contingency Fund,both the above funds,None of the above, ,B," No answer description available for this question. <a href=""discussion-152"">Let us discuss</a>. "
G.K,Misslaneous, ,The position of a chief minister is,similar to that of the prime minister,identical to that of the president,a combination of the position of the prime minister and president,not constitutional, ,A," No answer description available for this question. <a href=""discussion-133"">Let us discuss</a>. "
G.K,Misslaneous, ,The members of the Rajya Sabha are elected for a term,of six years,determined by the state legislative assembly of a state,of four years,None of the above, ,A," No answer description available for this question. <a href=""discussion-92"">Let us discuss</a>. "
G.K,Misslaneous, ,The office of the president can fall vacant due to,resignation,death,removal,All of the above, ,D," No answer description available for this question. <a href=""discussion-118"">Let us discuss</a>. "
G.K,Misslaneous, ,The president can dismiss a member of the council of ministers,on his own,on the recommendation of the prime  ministers,only under emergency conditions,with the consent of the speaker, ,B," No answer description available for this question. <a href=""discussion-156"">Let us discuss</a>. "
G.K,Misslaneous, ,"The president demand for further reforms, attended with the dislocation caused by the non-cooperation movement, led the British government to appoint a Statutory Commission in 1927. This commission was headed by",Sri John Simon,Lord Chelmsford,Lord Minto,E.S. Montague, ,A," No answer description available for this question. <a href=""discussion-160"">Let us discuss</a>. "
G.K,Misslaneous, ,The office of the prime minister of India,has a constitutional basis,has a statutory basis,has conventional basis,None of the above, ,A," No answer description available for this question. <a href=""discussion-120"">Let us discuss</a>. "
